{
  "build_outputs": {
    "html": "docs/static-documentation-portal/index.html",
    "source_doc": "docs/static-documentation-portal.md"
  },
  "current_public_release": {
    "github_release": "https://github.com/edithatogo/corpus-nz-hansard/releases/tag/v0.1.0",
    "huggingface_dataset": "https://huggingface.co/datasets/edithatogo/nz-hansard-corpus",
    "publication_status": "published",
    "release_level": "document-level",
    "version": "0.1.0",
    "zenodo_record": "https://zenodo.org/records/20595194"
  },
  "generated_at": "2026-06-23T10:48:39.836451+00:00",
  "manifest_version": 1,
  "reference_catalog": {
    "citation_guidance": [
      {
        "label": "Release ladder",
        "path": "docs/release-ladder.md"
      },
      {
        "label": "Publication status",
        "path": "docs/publication-status.md"
      },
      {
        "label": "Public release checklist",
        "path": "docs/public-release-checklist.md"
      },
      {
        "label": "Release evidence ledger",
        "path": "docs/release-evidence-ledger.md"
      },
      {
        "label": "Licensing and provenance",
        "path": "docs/licensing-and-provenance.md"
      },
      {
        "label": "Canonical ID and URI policy",
        "path": "docs/canonical-id-uri-policy.md"
      }
    ],
    "data_dictionary": [
      {
        "label": "Shared NZ corpus core schema",
        "path": "docs/shared-nz-corpus-core-schema.md"
      },
      {
        "label": "Neutral component model",
        "path": "docs/neutral-component-model.md"
      },
      {
        "label": "Endpoint contracts",
        "path": "docs/endpoint-contracts.md"
      },
      {
        "label": "Derived fields validation",
        "path": "docs/derived-fields-validation.md"
      },
      {
        "label": "Member identity resolution",
        "path": "docs/member-identity-resolution.md"
      },
      {
        "label": "Party attribution provenance",
        "path": "docs/party-attribution-provenance.md"
      },
      {
        "label": "Speech-turn segmentation contract",
        "path": "docs/speech-turn-segmentation-contract.md"
      }
    ]
  },
  "release_ladder_snapshot": {
    "artifact_map_count": 21,
    "current_public_release": {
      "immutable_policy": "The v0.1.0 document-level data snapshot is immutable except for metadata, documentation, cross-reference, and provenance corrections that do not alter public rows, columns, source hashes, or intended use.",
      "release_level": "document-level",
      "release_manifest": "manifests/public_dataset_release_manifest.json",
      "version": "0.1.0"
    },
    "release_levels": [
      {
        "id": "document-level",
        "level": 1,
        "status": "published"
      },
      {
        "id": "authority-source",
        "level": 2,
        "status": "validated-manifest"
      },
      {
        "id": "neutral-component",
        "level": 3,
        "status": "validated-manifest"
      },
      {
        "id": "endpoint",
        "level": 4,
        "status": "planned"
      },
      {
        "id": "upstream-contribution",
        "level": 5,
        "status": "planned"
      }
    ]
  },
  "repository": "corpus-nz-hansard",
  "site_root": "docs/static-documentation-portal/index.html",
  "sources": {
    "public_release_checklist": "docs/public-release-checklist.md",
    "public_release_manifest": "manifests/public_dataset_release_manifest.json",
    "publication_status": "docs/publication-status.md",
    "release_ladder": "manifests/release_ladder.json",
    "track_registry": "conductor/tracks.md"
  },
  "track_id": "static_documentation_portal_20260610",
  "track_snapshot": {
    "summary_counts": {
      "blocked": 19,
      "complete": 49,
      "in_progress": 0,
      "pending": 0
    },
    "tracks": [
      {
        "goal": "promote the local member identity review package into a corpus-wide validated derived component with release gates, schemas, manifests, and non-overclaiming docs. Repo-side builder/checker are implemented; publication remains blocked pending normalized corpus input and authority coverage review.",
        "link": "./tracks/corpus_wide_member_identity_release_20260610/",
        "status": "!",
        "title": "Corpus-Wide Member Identity Release",
        "track_id": "corpus_wide_member_identity_release_20260610"
      },
      {
        "goal": "promote party attribution from local/provenance fixtures into a temporal corpus-wide derived component that depends on validated member identity. Repo-side builder/checker are implemented; release remains blocked until corpus-wide member identity exists.",
        "link": "./tracks/corpus_wide_party_attribution_release_20260610/",
        "status": "!",
        "title": "Corpus-Wide Party Attribution Release",
        "track_id": "corpus_wide_party_attribution_release_20260610"
      },
      {
        "goal": "promote speech-turn candidates into a validated derived component only when the candidate artifact and validated member identity are both available. Repo-side builder/checker are implemented and candidate artifact exists (439 turns); release remains blocked pending validated member identity.",
        "link": "./tracks/validated_speech_turn_component_release_20260610/",
        "status": "!",
        "title": "Validated Speech-Turn Component Release",
        "track_id": "validated_speech_turn_component_release_20260610"
      },
      {
        "goal": "promote sitting/proceeding structures from design fixtures into validated corpus-wide neutral components reconciled to official sitting and proceeding evidence. Repo-side builder/checker and the comparison-ready historical ledger are implemented; release remains blocked until official historical comparison exists.",
        "link": "./tracks/sitting_proceeding_component_release_20260610/",
        "status": "!",
        "title": "Sitting And Proceeding Component Release",
        "track_id": "sitting_proceeding_component_release_20260610"
      },
      {
        "goal": "implement validated corpus-wide extraction for votes, motions, bills, oral/written questions, answers, and procedural decisions with provenance. Repo-side builder/checker are implemented; release remains blocked until validated member identity, party attribution, and sitting/proceeding components exist.",
        "link": "./tracks/vote_motion_bill_question_extraction_release_20260610/",
        "status": "!",
        "title": "Vote Motion Bill Question Extraction Release",
        "track_id": "vote_motion_bill_question_extraction_release_20260610"
      },
      {
        "goal": "move ParlaMint-NZ from endpoint contract/sample readiness to a scope-declared public release package with schema validation and maintainer-facing evidence. Repo-side builder/checker are implemented; release remains blocked until validated member identity, party attribution, speech-turn, and sitting/proceeding components exist.",
        "link": "./tracks/parlamint_nz_public_endpoint_release_20260610/",
        "status": "!",
        "title": "ParlaMint-NZ Public Endpoint Release",
        "track_id": "parlamint_nz_public_endpoint_release_20260610"
      },
      {
        "goal": "move Popolo/Open Civic Data from sample output to a validated public endpoint release. Repo-side builder/checker are implemented; release remains blocked pending validated member identity, party attribution, vote/motion extraction, and speech-turn components.",
        "link": "./tracks/popolo_opencivicdata_public_endpoint_release_20260610/",
        "status": "!",
        "title": "Popolo/Open Civic Data Public Endpoint Release",
        "track_id": "popolo_opencivicdata_public_endpoint_release_20260610"
      },
      {
        "goal": "move Akoma Ntoso from sample output to a validated public endpoint release with selected profile/schema evidence and source-span preservation. Repo-side builder/checker are implemented; release is blocked pending validated member identity, party attribution, speech-turn, motion, and vote components.",
        "link": "./tracks/akoma_ntoso_public_endpoint_release_20260610/",
        "status": "!",
        "title": "Akoma Ntoso Public Endpoint Release",
        "track_id": "akoma_ntoso_public_endpoint_release_20260610"
      },
      {
        "goal": "move CAP/ParlaCAP from sample topic output to a validated public release after topic codebooks, speech/proceeding units, and maintainer expectations are settled. Repo-side builder/checker are implemented; release is blocked pending validated speech-turn components and maintainer-confirmed codebook intake.",
        "link": "./tracks/cap_parlacap_public_endpoint_release_20260610/",
        "status": "!",
        "title": "CAP/ParlaCAP Public Endpoint Release",
        "track_id": "cap_parlacap_public_endpoint_release_20260610"
      },
      {
        "goal": "move UD/CoNLL-U from sample output to a validated NLP endpoint release with tokenizer/parser pinning, offset fidelity, and scope-declared coverage. Repo-side builder/checker are implemented; release is blocked pending validated speech-turn text and completed Stanza/spaCy comparison evidence.",
        "link": "./tracks/ud_conllu_public_endpoint_release_20260610/",
        "status": "!",
        "title": "UD/CoNLL-U Public Endpoint Release",
        "track_id": "ud_conllu_public_endpoint_release_20260610"
      },
      {
        "goal": "move RDF/JSON-LD from sample graph output to a validated public linked-data release with SHACL, stable URIs, PROV-O/DCAT/SKOS/W3C Time, and SPARQL examples.",
        "link": "./tracks/rdf_linked_data_public_endpoint_release_20260610/",
        "status": "!",
        "title": "RDF Linked Data Public Endpoint Release",
        "track_id": "rdf_linked_data_public_endpoint_release_20260610"
      },
      {